<?xml version="1.0" encoding="UTF-8" standalone="yes"?>
<Model xmlns="http://www.pooh.com/model/XMLschema" xmlns:xsi="http://www.w3.org/2001/XMLSchema-instance" xsi:schemaLocation="http://www.pooh.com/model/XMLschema rulesSchema.xsd">
    <Rules>
        <Rule resultFact="F">
            <And>
                <Fact fact="SS"/>
                <Fact fact="W"/>
            </And>
        </Rule>
        <Rule resultFact="E">
            <Or>
                <Or>
                    <Fact fact="A"/>
                    <Fact fact="B"/>
                </Or>
                <And>
                    <Fact fact="C"/>
                    <And>
                        <Fact fact="D"/>
                        <Fact fact="E"/>
                    </And>
                </And>
            </Or>
        </Rule>
    </Rules>
    <KnownFacts>
        <Fact>A</Fact>
        <Fact>S</Fact>
    </KnownFacts>
</Model>
